{
  "certificate_info": {
    "certificate_number": "桜花住証第2025-00001号",
    "issue_date": "2025-01-13",
    "issuing_office": "桜花市役所市民課",
    "issuing_officer": "窓口担当：田中",
    "certificate_type": "住民票の写し"
  },
  "resident_info": {
    "氏名": "桜田 一郎",
    "生年月日": "昭和53年3月15日",
    "性別": "男",
    "住所": {
      "現住所": "桜県桜花市中央地区1丁目1番1号",
      "方書": ""
    },
    "住民となった日": "平成20年10月15日",
    "住所を定めた日": "平成20年10月15日",
    "前住所": "桜県桜花市東地区3丁目4番5号",
    "世帯主": {
      "氏名": "桜田 一郎",
      "続柄": "本人"
    },
    "本籍": "桜県桜花市中央地区1丁目1番1号",
    "筆頭者": "桜田 一郎",
    "住民票コード": "28010000010"
  },
  "household_info": {
    "世帯構成員": [
      {
        "氏名": "桜田 一郎",
        "続柄": "世帯主",
        "生年月日": "昭和53年3月15日",
        "性別": "男"
      },
      {
        "氏名": "桜田 花子",
        "続柄": "妻",
        "生年月日": "昭和55年7月22日",
        "性別": "女"
      },
      {
        "氏名": "桜田 太郎",
        "続柄": "子",
        "生年月日": "平成22年9月5日",
        "性別": "男"
      },
      {
        "氏名": "桜田 美咲",
        "続柄": "子",
        "生年月日": "平成25年4月12日",
        "性別": "女"
      }
    ]
  },
  "additional_info": {
    "備考": [
      "平成20年10月15日 婚姻により東地区より転居",
      "令和2年4月1日 住居表示実施"
    ],
    "履歴": [
      {
        "日付": "2000-04-01",
        "事由": "転居",
        "詳細": "桜花市西地区より東地区へ転居"
      },
      {
        "日付": "2008-10-15",
        "事由": "転居",
        "詳細": "婚姻により東地区より中央地区へ転居"
      }
    ]
  },
  "certification": {
    "認証文": "上記のとおり相違ないことを証明する。",
    "発行者": {
      "役職": "桜県桜花市長",
      "氏名": "山本 太郎",
      "印章": "桜花市長之印"
    }
  },
  "usage_info": {
    "有効期限": "発行日から3ヶ月",
    "使用目的": "運転免許証更新",
    "提出先": "桜県警察本部運転免許センター"
  }
}